{
  "series": "월하노인을 잡아라 (숏폼 24부작)",
  "episode": 22,
  "title": "혼례날",
  "hook": "혼례 잔치에 불려 간 전기수가, 신랑이 도망가는 법을 읽는다.",
  "runtime_sec": 180,
  "aspect": "16:9",
  "status": "skeleton",
  "scenes": [
    {
      "id": "S#0",
      "heading": "지난 대목 — 종로 담배가게 앞 평상 (낮)",
      "location": "jongno_tobacco",
      "time": "DAY",
      "tc_in": "00:00",
      "tc_out": "00:12",
      "characters": [
        "gangsu",
        "dallae",
        "meoksun",
        "jeonggyeom"
      ],
      "mood": "COMEDY",
      "summary": "강수의 '지난 대목'(시그니처). 21화를 12초로 요약하고 부채를 접으며 오늘 대목을 연다.",
      "source_text": "평상 위의 강수가 부채를 촥 펴고 카메라를 본다.\nFlash. (21화) 연못 밑 옹기 속 아버지의 쪽지. \"아비는 술을 마시지 않았다.\"\n(N, 강수) 지난 대목에 이르기를, 이번엔 귀가 빨개지지 않았고, 아버지의 소설은 첫 글자마다 딸을 불렀소. '아비는 술을 마시지 않았다.'\n**강수** (부채를 탁 접으며) 자, 오늘 대목이오.",
      "shots": [
        {
          "id": "S00-01",
          "size": "MCU",
          "angle": "LOW",
          "move": "FIX",
          "lens_mm": 50,
          "characters": [
            "gangsu"
          ],
          "frame": "평상 위 강수 정면. 부채를 촥 펴며 카메라를 본다(제4의 벽). 뒤로 구경꾼들이 흐리다.",
          "action": "평상 위의 강수가 부채를 촥 펴고 카메라를 본다.",
          "sound": "(E) 부채 펴는 소리 촥",
          "motifs": [
            "NARRATOR"
          ],
          "transition": "CUT",
          "duration_sec": 2,
          "continuity": "지난 대목은 이야기 밖 액자다. 매회 같은 구도, 1화 강수 차림 그대로(부상·붕대 없음), 평상은 화면 가운데",
          "image_prompt": "low angle medium close-up, the storyteller on his wooden platform snapping open a folding fan and looking straight at the viewer, blurred crowd behind, warm daylight",
          "image_from": "ep02/S00-01",
          "image_filter": "none"
        },
        {
          "id": "S00-02",
          "size": "MS",
          "angle": "EYE",
          "move": "CRANE_UP",
          "lens_mm": 35,
          "characters": [
            "dallae",
            "jeonggyeom",
            "meoksun"
          ],
          "frame": "Flash. 21화 마지막 컷(S05-09)을 탈색해 다시 보여 준다. 쪽지를 든 달래가 웃다가 운다. 진흙투성이 정겸과 먹순이 곁에 선다. 달래에서 크레인 업, 초롱 하나를 둘러싼 세 사람과 마른 연못이 작아진다.",
          "action": "연못 밑 옹기 속 아버지의 쪽지. \"아비는 술을 마시지 않았다.\"",
          "dialogue": [
            {
              "speaker": "N:gangsu",
              "line": "지난 대목에 이르기를, 이번엔 귀가 빨개지지 않았고, 아버지의 소설은 첫 글자마다 딸을 불렀소. '아비는 술을 마시지 않았다.'",
              "mode": "N"
            }
          ],
          "motifs": [
            "NARRATOR"
          ],
          "transition": "CUT",
          "duration_sec": 7,
          "image_from": "ep21/S05-09",
          "image_filter": "desaturate",
          "image_prompt": "desaturated memory. medium shot rising into a crane-up, the young woman laughing and crying with a note in her hands, the mud-covered scholar and the shop girl beside her, the lantern and the dry pond growing small in the night"
        },
        {
          "id": "S00-03",
          "size": "MCU",
          "angle": "LOW",
          "move": "FIX",
          "lens_mm": 50,
          "characters": [
            "gangsu"
          ],
          "frame": "S00-01과 같은 구도. 부채를 탁 접고 고개를 까딱한다.",
          "action": "강수가 부채를 탁 접으며 오늘 대목을 연다.",
          "dialogue": [
            {
              "speaker": "gangsu",
              "line": "자, 오늘 대목이오.",
              "mode": "ON"
            }
          ],
          "sound": "(E) 부채 접는 소리 탁",
          "motifs": [
            "NARRATOR"
          ],
          "transition": "SMASH_CUT",
          "duration_sec": 3,
          "image_prompt": "low angle medium close-up, the storyteller snapping his folding fan shut with a sly grin, looking at the viewer, warm daylight",
          "image_from": "ep02/S00-03",
          "image_filter": "none"
        }
      ]
    },
    {
      "id": "S#1",
      "heading": "달래책방 안채 (새벽)",
      "location": "dallae_anchae",
      "time": "DAWN",
      "tc_in": "00:12",
      "tc_out": "00:40",
      "characters": [
        "dallae",
        "gangsu",
        "meoksun"
      ],
      "summary": "",
      "source_text": "등잔이 다 타 간다. 달래가 밤새 쓴 원고를 묶는다. 눈은 붉지만 손은 빠르다. 강수가 붕대를 푼 팔로 원고를 받는다.\n**달래** 아버지는 끝까지 써 주셨어. 그러니까 나도 써 줄게. 오라버니 대목.\nInsert. 원고 첫 장. '혼례날 신랑이 도망가는 법'.\n**강수** (원고를 넘기며) …이걸 잔치에서 읽으라고?\n**달래** 막장의 법칙. 하나, 신랑에게도 사정이 있다. (사이) 그 집 아들, 우리 먹순이만 보면 얼굴이 빨개지더라.",
      "shots": []
    },
    {
      "id": "S#2",
      "heading": "윤희의 집 마당 — 초례청 (낮)",
      "location": "yunhui_house",
      "time": "DAY",
      "tc_in": "00:40",
      "tc_out": "01:10",
      "characters": [
        "ma_yeonggam",
        "ma_seobang",
        "gangsu",
        "yunhui",
        "meoksun"
      ],
      "summary": "",
      "source_text": "초례상 위에 나무 기러기 한 쌍. 원삼에 족두리를 쓴 윤희가 고개를 숙이고 있다. 맞은편 마 서방은 사모관대가 어색해 계속 사모를 고쳐 쓴다. 마 영감은 하객들에게 연신 절을 한다. 마당 한쪽 멍석 위에 강수가 앉아 있다. 하객들 틈에 먹순이 떡 바구니를 들고 서 있다.\n**마 영감** 자, 잔치에는 이야기가 있어야지! 종로 제일의 전기수다!\n강수가 원고를 편다. 윤희가 고개를 아주 조금 든다. 둘의 눈이 마주친다. 이번엔 강수가 원고에서 눈을 떼지 않는다.",
      "shots": []
    },
    {
      "id": "S#3",
      "heading": "같은 장소 (낮)",
      "location": "yunhui_house",
      "time": "DAY",
      "tc_in": "01:10",
      "tc_out": "02:05",
      "characters": [
        "ma_yeonggam",
        "ma_seobang",
        "gangsu",
        "yunhui",
        "meoksun"
      ],
      "summary": "",
      "source_text": "**강수** 옛날 옛적, 혼례날 아침에 신랑이 울었소. 신부가 싫어서가 아니라, 다른 사람을 좋아해서. 책방에서 먹 냄새를 맡고, 떡을 나눠 먹던 그 사람을.\n하객들이 웃는다. 마 서방의 얼굴이 하얘진다. 먹순의 떡 바구니가 기운다.\n**강수** 신랑은 생각했소. 오늘 말하지 않으면, 평생 남의 대사로 살겠구나.\n마 서방이 초례상 앞으로 한 걸음 나선다. 사모가 떨어진다.\n**마 서방** 아버지! 저 딴 사람 있어요! (손가락으로 가리키며) 먹순이요!\n**먹순** (떡을 문 채) …저요?\n**마 영감** 이놈아! 너 미쳤냐!\n**홍 참판** (O.S., 대청에서) 이게 무슨 해괴한 짓이냐!\n윤희가 천천히 족두리를 벗어 초례상에 내려놓는다.\n**윤희** 아버지. 혼처는 아버지가 고르셨으니, 파혼은 제가 고를게요.\n마당이 조용해진다. 나무 기러기 한 마리가 상 위에서 쓰러진다.",
      "shots": []
    },
    {
      "id": "S#4",
      "heading": "윤희의 집 별당 담장 아래 (밤)",
      "location": "yunhui_byeoldang",
      "time": "NIGHT",
      "tc_in": "02:05",
      "tc_out": "02:40",
      "characters": [
        "gangsu",
        "yunhui"
      ],
      "summary": "",
      "source_text": "잔치 등롱이 하나둘 꺼진다. 담장 아래 강수와 윤희. 윤희는 원삼을 벗고 분홍 저고리 차림이다.\n**강수** 대본 없이 하겠소. 아씨 앞에서는 대사를 다 까먹으니까. (숨을 고르고) 좋아하오.\n윤희가 강수를 오래 본다.\n**윤희** …다음 대목은요?\n**강수** 그건 엽전 소리를 들어야 나오는 법이오.\n윤희가 소매에서 엽전 하나를 꺼낸다. 던지려다, 다시 손에 쥔다.\n**윤희** 엽전은 아껴 둘래요. 제일 좋은 대목에 던지게.",
      "shots": []
    },
    {
      "id": "S#5",
      "heading": "종로 담배가게 앞 (새벽)",
      "location": "jongno_tobacco",
      "time": "DAWN",
      "tc_in": "02:40",
      "tc_out": "03:00",
      "characters": [
        "gangsu"
      ],
      "summary": "",
      "source_text": "닫힌 담배가게. 강수가 평상 밑에서 담배 써는 칼을 꺼낸다. 칼날에 새벽빛이 스친다. 서소문 쪽에서 안개가 밀려온다.\n(N, 강수) 제일 좋은 대목에 엽전을 받으려면, 먼저 끝내야 할 대목이 있었소. 스승님의 대목.\n강수가 안개 속으로 걸어간다.",
      "shots": []
    }
  ]
}
