{
  "series": "월하노인을 잡아라 (숏폼 24부작)",
  "episode": 13,
  "title": "책장을 넘기는 손",
  "hook": "칼 맞은 전기수는 책장을 넘길 손이 없다. 대신 넘겨 주겠다는 아씨가 찾아온다.",
  "runtime_sec": 180,
  "aspect": "16:9",
  "status": "skeleton",
  "scenes": [
    {
      "id": "S#0",
      "heading": "지난 대목 — 종로 담배가게 앞 평상 (낮)",
      "location": "jongno_tobacco",
      "time": "DAY",
      "tc_in": "00:00",
      "tc_out": "00:12",
      "characters": [
        "gangsu",
        "yul"
      ],
      "mood": "COMEDY",
      "summary": "강수의 '지난 대목'(시그니처). 12화를 12초로 요약하고 부채를 접으며 오늘 대목을 연다.",
      "source_text": "평상 위의 강수가 부채를 촥 펴고 카메라를 본다.\nFlash. (12화) 책방 앞을 막아선 율. 피가 발끝에 떨어진다.\n(N, 강수) 지난 대목에 이르기를, 칼을 맞은 이 몸이 스승을 찌른 그 눈을 다시 보았고, 책방 앞을 막아선 율의 발끝에 피가 떨어졌소.\n**강수** (부채를 탁 접으며) 자, 오늘 대목이오.",
      "shots": [
        {
          "id": "S00-01",
          "size": "MCU",
          "angle": "LOW",
          "move": "FIX",
          "lens_mm": 50,
          "characters": [
            "gangsu"
          ],
          "frame": "평상 위 강수 정면. 부채를 촥 펴며 카메라를 본다(제4의 벽). 뒤로 구경꾼들이 흐리다.",
          "action": "평상 위의 강수가 부채를 촥 펴고 카메라를 본다.",
          "sound": "(E) 부채 펴는 소리 촥",
          "motifs": [
            "NARRATOR"
          ],
          "transition": "CUT",
          "duration_sec": 2,
          "continuity": "지난 대목은 이야기 밖 액자다. 매회 같은 구도, 1화 강수 차림 그대로(부상·붕대 없음), 평상은 화면 가운데",
          "image_prompt": "low angle medium close-up, the storyteller on his wooden platform snapping open a folding fan and looking straight at the viewer, blurred crowd behind, warm daylight",
          "image_from": "ep02/S00-01",
          "image_filter": "none"
        },
        {
          "id": "S00-02",
          "size": "LS",
          "angle": "HIGH",
          "move": "CRANE_UP",
          "lens_mm": 24,
          "characters": [
            "yul"
          ],
          "frame": "Flash. 12화 마지막 컷(S05-12)을 탈색해 다시 보여 준다. 율이 담에서 몸을 떼어 화면 오른쪽 어둠으로 걸어 나간다. 카메라가 올라가면 초롱빛 아래 핏방울 자국만 남고, 담 너머 책방 불빛이 화면 왼쪽에 걸린다.",
          "action": "책방 앞을 막아선 율. 피가 발끝에 떨어진다.",
          "dialogue": [
            {
              "speaker": "N:gangsu",
              "line": "지난 대목에 이르기를, 칼을 맞은 이 몸이 스승을 찌른 그 눈을 다시 보았고, 책방 앞을 막아선 율의 발끝에 피가 떨어졌소.",
              "mode": "N"
            }
          ],
          "motifs": [
            "NARRATOR"
          ],
          "transition": "CUT",
          "duration_sec": 7,
          "image_from": "ep12/S05-12",
          "image_filter": "desaturate",
          "image_prompt": "desaturated memory. high angle crane up, the young nobleman walking away into the dark end of the alley, leaving drops of blood in a pool of lantern light beneath the wall, the glowing bookshop windows beyond the wall on the left"
        },
        {
          "id": "S00-03",
          "size": "MCU",
          "angle": "LOW",
          "move": "FIX",
          "lens_mm": 50,
          "characters": [
            "gangsu"
          ],
          "frame": "S00-01과 같은 구도. 부채를 탁 접고 고개를 까딱한다.",
          "action": "강수가 부채를 탁 접으며 오늘 대목을 연다.",
          "dialogue": [
            {
              "speaker": "gangsu",
              "line": "자, 오늘 대목이오.",
              "mode": "ON"
            }
          ],
          "sound": "(E) 부채 접는 소리 탁",
          "motifs": [
            "NARRATOR"
          ],
          "transition": "SMASH_CUT",
          "duration_sec": 3,
          "image_prompt": "low angle medium close-up, the storyteller snapping his folding fan shut with a sly grin, looking at the viewer, warm daylight",
          "image_from": "ep02/S00-03",
          "image_filter": "none"
        }
      ]
    },
    {
      "id": "S#1",
      "heading": "달래책방 안채 (낮)",
      "location": "dallae_anchae",
      "time": "DAY",
      "tc_in": "00:12",
      "tc_out": "00:45",
      "characters": [
        "gangsu",
        "yunhui",
        "meoksun"
      ],
      "summary": "",
      "source_text": "강수가 왼팔에 붕대를 감은 채 서안 앞에 앉아 있다. 새 대목을 외우려고 한 손으로 책장을 넘기다 책을 떨어뜨린다. 먹순이 죽 그릇을 들고 들어온다.\n**먹순** 오라버니, 죽부터 드세요. 책은 손이 둘일 때 읽고.\n**강수** 전기수가 책을 못 넘기면 그게 전기수냐.\n(E) 똑똑. 대문 쪽. 먹순이 나갔다가 허겁지겁 돌아온다.\n**먹순** 오라버니! 양반댁 아씨가 오라버니를 찾아요!\n강수가 벌떡 일어서다가 팔을 붙잡고 신음한다. 장옷을 쓴 윤희가 보따리를 든 하녀와 함께 문턱에 선다.",
      "shots": []
    },
    {
      "id": "S#2",
      "heading": "같은 장소 (낮)",
      "location": "dallae_anchae",
      "time": "DAY",
      "tc_in": "00:45",
      "tc_out": "01:40",
      "characters": [
        "gangsu",
        "yunhui"
      ],
      "summary": "",
      "source_text": "윤희가 보따리를 푼다. 「청상연가」 한 권. 여백마다 서로 다른 글씨가 빼곡하다.\n**윤희** 월하회 아씨들이 여백에 문안 편지를 썼어요. 첫 글자만 이어 읽으면 '빨리 나으세요'.\n강수가 여백을 짚어 가며 읽는다. 괜히 헛기침을 한다.\n**윤희** 그리고 이건 제 거예요. (약첩을 내밀며) 우리 집 의원한테 지었어요.\n**강수** 아씨가 왜 이렇게까지….\n**윤희** 다음 대목을 들어야 하니까요. 손을 못 쓰시면, 제가 넘길게요.\n윤희가 강수 곁에 앉아 책을 펼쳐 든다. 강수가 읽고, 윤희가 넘긴다. 어깨 사이가 한 뼘이다. 강수의 목소리가 점점 작아지다가 끊긴다.\n**윤희** (속삭이듯) \"달이 지면 내가 가겠소.\"\n**강수** …달이 지면 내가 가겠소.\n다음 줄에서 또 막힌다. 이번엔 윤희가 입을 다문다.\n**윤희** 이번엔 안 알려 드릴래요.\n**강수** (한참 있다가) …책장을 넘겨 주는 손이, 생각보다 따뜻하였소.\n**윤희** (책을 내려다보다) …그건 책에 없는 줄인데요.\n**강수** 방금 생겼소.",
      "shots": []
    },
    {
      "id": "S#3",
      "heading": "달래책방 마당 (해 질 녘)",
      "location": "dallae_maru",
      "time": "DUSK",
      "tc_in": "01:40",
      "tc_out": "02:20",
      "characters": [
        "gangsu",
        "yunhui"
      ],
      "summary": "",
      "source_text": "강수가 윤희를 대문까지 바래다준다. 붕대 감은 팔을 등 뒤로 숨긴다.\n**윤희** 누가 그런 거예요.\n**강수** 이 년 전, 우리 스승님이 종로에서 칼에 찔려 돌아가셨소. 며칠 전 밤, 그 칼을 다시 봤소.\n**윤희** 그럼 그 이야기는 끝까지 읽으셔야겠네요.\n강수가 멈칫한다.\n**강수** …스승님도 마지막에 그 말을 하셨소. 끝까지 읽으라고.\n윤희가 대답 대신 고개를 숙여 인사하고, 장옷을 여미며 골목으로 나간다. 강수는 대문 기둥에 기대어 그 뒷모습이 모퉁이를 돌 때까지 서 있다.",
      "shots": []
    },
    {
      "id": "S#4",
      "heading": "윤희의 집 사랑채 앞 / 달래책방 안채 (밤)",
      "location": "yunhui_house",
      "time": "NIGHT",
      "tc_in": "02:20",
      "tc_out": "03:00",
      "characters": [
        "ma_yeonggam",
        "dallae",
        "gangsu",
        "yunhui",
        "meoksun"
      ],
      "summary": "",
      "source_text": "윤희가 사랑채 앞을 지나간다. 문틈으로 불빛과 목소리가 새어 나온다.\n**홍 참판** (O.S.) 오늘 혼처를 정했다. 종로 마 영감 댁 아들이다. 서녀를 데려가겠다는 집이 어디 흔하더냐.\n윤희의 발이 멈춘다. 손에 쥔 빈 약첩 보자기가 구겨진다.\n달래책방 안채. 강수가 한 손으로 문안 편지가 적힌 책을 넘긴다. 마지막 장 여백에, 다른 글씨들보다 반듯한 한 줄.\nInsert. '다음 대목도 제가 넘길게요. — 윤희'\n강수가 웃는다. 그때 먹순이 숨이 넘어가게 뛰어 들어온다.\n**먹순** 오라버니! 마 영감이 아들 장가를 보낸대요! 참판댁 아씨한테! 벌써 온 종로에 떠들고 다녀요!\n강수의 웃음이 그대로 굳는다.",
      "shots": []
    }
  ]
}
